{
  "consortium": "PEC",
  "grant": "U01AG046139",
  "study": "BrainGVEX",
  "group": "JHU",
  "investigatorName": "Fernando Goes",
  "individualID": "FG-0001",
  "individualIdSource": "MSSM",
  "species": "Human",
  "reportedGender": "Unknown",
  "postmortem": "False",
  "organ": "blood",
  "specimenID": "FG-GG-BL-0001",
  "tissue": "blood",
  "cellType": "CD8+ T-Cells",
  "nucleicAcidSource": "single cell",
  "reprogrammedCellType": "T-Cell",
  "terminalDifferentiationPoint": "lsdkfj",
  "passage": 0,
  "assay": "exomeSeq",
  "libraryID": "branch-0001",
  "isStranded": true,
  "RIN": 42,
  "readLength": "longenough",
  "platform": "Illumina_1M",
  "runType": "pairedEnd",
  "libraryPrep": "rRNAdepletion",
  "libraryPreparationMethod": "10x",
  "fileFormat": "fastq",
  "referenceSet": "GRCh38",
  "readPair": 2,
  "biologicalReplicate": "F",
  "isogenicReplicate": "F",
  "anisogenicReplicate": "F",
  "technicalReplicate": "F",
  "sequencingReplicate": "F"
}
