{
  "consortium": "PEC",
  "grant": "U01AG046139",
  "study": "BrainGVEX",
  "group": "JHU",
  "investigatorName": "Fernando Goes",
  "individualID": "FG-0001",
  "individualIdSource": "MSSM",
  "species": "Human",
  "reportedGender": "Unknown",
  "postmortem": "True",
  "sex" : "male",
  "race": "Caucasian",
  "raceDetail": "Non-Hispanic",
  "genotypeInferredAncestry": "French",
  "IQ": 160,
  "BMI": 39,
  "primaryDiagnosis": "Bipolar Disorder",
  "primaryDiagnosisDetail": "Unknown at this time",
  "otherDiagnosis": "Schizophrenia",
  "otherDiagnosisDetail": "Unknown at this time",
  "familyHistory": "Unknown",
  "ageOnset": 17,
  "neuropathDescription": "None",
  "dementia": "True",
  "CDR": 2,
  "braak": 1,
  "otherMedicalDx": "Hypertension",
  "otherMedicalDetail": "Unknown at this time",
  "deathAge": 37,
  "deathAgeUnits": "years",
  "causeDeath": "Old Age",
  "deathManner": "undetermined",
  "postmortemTox": "True",
  "postmortemToxSource": "Liver",
  "medRecordTox": "False",
  "organ": "brain",
  "PMICertain": "Unknown",
  "PMI": "Yep",
  "pH": "acidic",
  "organWeight": 5,
  "organRIN": 20,
  "yearAutopsy": 2013,
  "specimenID": "FG-GG-BL-0001",
  "tissue": "blood",
  "cellType": "CD8+ T-Cells",
  "nucleicAcidSource": "single cell",
  "BrodmannArea": "BA9",
  "reprogrammedCellType": "T-Cell",
  "terminalDifferentiationPoint": "lsdkfj",
  "passage": 0,
  "assay": "ChIPSeq",
  "assayTarget": "H3K27ac",
  "libraryID": "branch-0001",
  "isStranded": true,
  "RIN": 42,
  "readLength": "longenough",
  "platform": "Illumina_1M",
  "runType": "pairedEnd",
  "libraryPrep": "rRNAdepletion",
  "libraryPreparationMethod": "10x",
  "fileFormat": "fastq",
  "referenceSet": "GRCh38",
  "readPair": 2,
  "FRiP": 29,
  "biologicalReplicate": "F",
  "isogenicReplicate": "F",
  "anisogenicReplicate": "F",
  "technicalReplicate": "F",
  "sequencingReplicate": "F"
}
